Title,Image Link,Release,Rating,Metacritic,Description,Audience,Directors,Runtime,Genres
Timbuktu,https://www.metacritic.com/a/img/resize/dece8f363144ddda8122e14dbe60652de01ff666/catalog/provider/2/2/2-fb69898c12a4a792fdc3121aa0bcd8cc.jpg?auto=webp&fit=cover&height=132&width=88,2015,PG-13,92.0,"Not far from Timbuktu, now ruled by the religious fundamentalists, Kidane lives peacefully in the dunes with his wife Satima, his daughter Toya, and Issan, their twelve-year-old shepherd. In town, the people suffer, powerless, from the regime of terror imposed by the Jihadists determined to control their faith. Music, laughter, cigarettes, even soccer have been banned. The women have become shadows but resist with dignity. Every day, the new improvised courts issue tragic and absurd sentences. Kidane and his family are being spared the chaos that prevails in Timbuktu. But their destiny changes when Kidane accidentally kills Amadou, the fisherman who slaughtered his beloved cow. He now has to face the new laws of the foreign occupants.",7.3,Abderrahmane Sissako,1 h 36 m,"['Drama', 'War']"
Frenzy,https://www.metacritic.com/a/img/resize/8b8c0060db3d9ec0597d9e00abd5dc17c90b2343/catalog/provider/2/2/2-1b779c0a279e5eb7ab583a6e3942dbd3.jpg?auto=webp&fit=cover&height=132&width=88,1972,TV-14,92.0,"A serial murderer is strangling women with a necktie. The London police have a suspect, but he is the wrong man.",7.5,Alfred Hitchcock,1 h 56 m,['Thriller']
Brief Encounter,https://www.metacritic.com/a/img/resize/c12c906124fe1a399503bdc14d7fa87c57cac4dc/catalog/provider/2/2/2-cf25a12282d8f09ceec37286e68149b7.jpg?auto=webp&fit=cover&height=132&width=88,1946,Approved,92.0,"Meeting a stranger in a railway station, a woman is tempted to cheat on her husband.",7.6,David Lean,1 h 26 m,"['Drama', 'Romance']"
Days,https://www.metacritic.com/a/img/resize/2b4e05c862391740b63313c6e569d5ab781b8f35/catalog/provider/2/2/2-245b45f27e486533d162393eda62b7d3.jpg?auto=webp&fit=cover&height=132&width=88,2021,Unrated,92.0,"Under the pain of illness and treatment, Kang (Lee Kang-sheng) finds himself adrift. He meets Non (Anong Houngheuangsy) in a foreign land. They find consolation in each other before parting ways and carrying on with their days.",0,Ming-liang Tsai,2 h 7 m,['Drama']
Cool Hand Luke,https://www.metacritic.com/a/img/resize/248d24dda90ad655430f603f819da6db5dd88122/catalog/provider/2/2/2-fd631318a98ed84672c253aeb6adcc52.jpg?auto=webp&fit=cover&height=132&width=88,1967,Approved,92.0,"When Luke Jackson (Paul Newman) is arrested for drunkenly vandalizing parking meters, he is sentenced to serve time on a prison chain gang. Although the warden, guards and prisoners all try to break Luke's spirit upon his arrival, it soon becomes clear that Luke is not about to play by anyone else's rules. He eventually earns the respect of his fellow inmates by refusing to back down in a fight, and he earns their friendship by figuring out a way for them to get their hard labor done in half the time. Luke eventually becomes a symbol of hope and resilience for his fellow prisoners, but the more he becomes revered by the inmates, the more he becomes a symbol of rebelliousness that must be stamped out by the Captain (Strother Martin). [Warner Bros.]",8.4,Stuart Rosenberg,2 h 7 m,"['Crime', 'Drama']"
Little Women,https://www.metacritic.com/a/img/resize/9c7c679833e8096e1469fff5bf9cdec9862e62b5/catalog/provider/2/2/2-5e5320f0959591a2993e210e9d2d4339.jpg?auto=webp&fit=cover&height=132&width=88,1933,Passed,92.0,A chronicle of the lives of a group of sisters growing up in nineteenth-century America.,7.6,Gillian Armstrong,1 h 55 m,"['Drama', 'Family', 'Romance']"
The Act of Killing,https://www.metacritic.com/a/img/resize/0db23f8512444ddf6257813a3c2e5989fa01f76e/catalog/provider/2/2/2-8f90c4a97a22769c2e2e029f7736f564.jpg?auto=webp&fit=cover&height=132&width=88,2013,Rated,92.0,A documentary in which former Indonesian death squad leaders reenact their real-life mass-killings in various cinematic genres.,8.3,"Joshua Oppenheimer,

      Anonymous,

      Christine Cynn",1 h 57 m,"['Documentary', 'Biography', 'Crime', 'History', 'War']"
De Humani Corporis Fabrica,https://www.metacritic.com/a/img/resize/ca4e6b411567f78e6db83fc0d9b85639011aad0e/catalog/provider/2/2/2-108a86192f782244c3004f70def0faff.jpg?auto=webp&fit=cover&height=132&width=88,2023,Unrated,92.0,"Five centuries ago, anatomist André Vésale opened up the human body to science for the first time in history. Today, De Humani Corporis Fabrica opens the human body to the cinema. It reveals that human flesh is an extraordinary landscape that exists only through the gaze and attention of others. As places of care, suffering and hope, hospitals are laboratories that connect every body in the world.",6.8,"Lucien Castaing-Taylor,

      Verena Paravel",1 h 55 m,['Documentary']
Maborosi,https://www.metacritic.com/a/img/resize/69e96cc6cd8eb251e14ed4d7b46c6c2f9793b811/catalog/provider/2/2/2-29b92fb6db264c8baf3404f8950770d9.jpg?auto=webp&fit=cover&height=132&width=88,1997,Rated,92.0,"A young woman's husband apparently commits suicide without warning or reason, leaving behind his wife and infant. Yumiko remarries and moves from Osaka to a small fishing village, yet continues to search for meaning in a lonely world.",7.9,Hirokazu Koreeda,1 h 50 m,['Drama']
Never Rarely Sometimes Always,https://www.metacritic.com/a/img/resize/52947b9c354426c8cc5559325fe802cf8d13ea10/catalog/provider/2/2/2-fbaba54681cb1e59c3a0271e35712fad.jpg?auto=webp&fit=cover&height=132&width=88,2020,PG-13,92.0,"Faced with an unintended pregnancy and a lack of local support, Autumn (Sidney Flanigan) and her cousin Skylar (Talia Ryder) embark across state lines to New York City on a fraught journey of friendship, bravery and compassion",0.9,Eliza Hittman,1 h 41 m,['Drama']
Annie Hall,https://www.metacritic.com/a/img/resize/a85097290ee2c212cd9235d77a35f55cb54d203f/catalog/provider/2/2/2-cef70036041741c84697d1d78e89dffa.jpg?auto=webp&fit=cover&height=132&width=88,1977,PG,92.0,"Woody Allen portrays a neurotic, highly insecure and indecisive comedy writer who falls head over heels in love with a naive small-town girl who aspires to be a singer. The opening rounds of their relationship involve every romantic cliche. And despite having moved in together, his insecurities get the best of him as he interprets her every move as rejection. While her self-confidence grows, his progressively fades. Can this oddball romance survive?",6.8,Woody Allen,1 h 33 m,"['Comedy', 'Romance']"
The Lord of the Rings: The Fellowship of the Ring,https://www.metacritic.com/a/img/resize/08a607d80b41532434c7959a7bda911190bf454a/catalog/provider/2/2/2-d023dfb5af835ebfc78f4b41911dd1a7.jpg?auto=webp&fit=cover&height=132&width=88,2001,PG-13,92.0,"An epic adventure of good against evil, a story of the power of friendship and individual courage, and the heroic quest to pave the way for the emergence of mankind, J.R.R. Tolkien's master work brought to cinematic life.  [New Line Cinema]",9.0,Peter Jackson,2 h 58 m,"['Action', 'Adventure', 'Drama', 'Fantasy']"
Quiz Show,https://www.metacritic.com/a/img/resize/e4cb569096f438d542a20dfc8f9d768933d5db33/catalog/provider/2/2/2-e1ae4ec86d558cfc4566d79c0d5cc8e9.jpg?auto=webp&fit=cover&height=132&width=88,1994,PG-13,92.0,"This fact-based film tells the story behind the quiz show scandal of the 1950s, focusing on ""Twenty-One"" champion Charles Van Doren (Fiennes).",8.4,Robert Redford,2 h 13 m,"['Biography', 'Drama', 'History']"
Leviathan,https://www.metacritic.com/a/img/resize/34976b3b5bf73885b88472c7f978d66b579be191/catalog/provider/2/2/2-235a60746315463faf888e0b6ba444be.jpg?auto=webp&fit=cover&height=132&width=88,2014,R,92.0,"Kolia lives in a small town near the Barents Sea in North Russia. He has his own auto-repair shop. His shop stands right next to the house where he lives with his young wife Lilya and his son from a previous marriage. Vadim Shelevyat, the Mayor of the town, wants to take away his business, his house and his land. First he tries buying off Kolia, but Kolia cannot stand losing everything he has, not only the land, but also all the beauty that has surrounded him from the day of his birth. So Vadim Shelevyat starts being more aggressive.",6.0,"Lucien Castaing-Taylor,

      Verena Paravel",1 h 27 m,['Documentary']
Werckmeister Harmonies,https://www.metacritic.com/a/img/resize/485ae86e345bc14d04962d340bcc2d76f7289c88/catalog/provider/2/2/2-6f75682ecafba8d7af48a801ca20d2ca.jpg?auto=webp&fit=cover&height=132&width=88,2001,Rated,92.0,"Based on László Krasznahorkai's novel ""The Melancholy of Resistance,"" this is an uncanny fable about powerlessness and tyranny. Set in a small Hungarian village at a moment of great crisis, a mysterious circus comes to town with a giant whale and news of an appearance by a Prince known for his strange powers. Soon the locals' emotions are stirred to a fever pitch of anticipation.  (Anthology Film Archives)",7.9,"Béla Tarr,

      Ágnes Hranitzky",2 h 25 m,"['Drama', 'Mystery']"
Le Cercle Rouge (1970),https://www.metacritic.com/a/img/resize/32ed45e6ba63addd6865946cb8c425bce9fff47c/catalog/provider/2/2/2-6848f07b49c193236b39d171be71be97.jpg?auto=webp&fit=cover&height=132&width=88,2003,Rated,92.0,"Corey (Alain Delon) is an aristocratic thief, released from prison on the same day that Vogel (Gian-Maria Volonté), a murderer, escapes from the custody of Mattei (Bourvil), a cat-loving police superintendent. Corey robs Rico (André Ekyan), his mob boss, then enlists Vogel and an ex-police sharpshooter, Jansen (Yves Montand), in a jewel heist. While Corey is harried by the vengeful Rico, Mattei pressures Santi, a nightclub owner and pimp, to help him trap the thieves.",7.9,Jean-Pierre Melville,2 h 20 m,"['Crime', 'Drama', 'Thriller']"
Toy Story 3,https://www.metacritic.com/a/img/resize/3a04f594db2902c17271dc68da3ecb0d314298bf/catalog/provider/2/2/2-e4fb66e8c8c842aad2d15bd9fff6548f.jpg?auto=webp&fit=cover&height=132&width=88,2010,G,92.0,"Toy Story 3 is a comical new adventure in Disney Digital 3D that lands the toys in a room full of untamed tots who can't wait to get their sticky little fingers on these ""new"" toys. It's pandemonium as they try to stay together, ensuring ""no toy gets left behind."" Meanwhile, Barbie comes face to plastic face with Ken (yes, that Ken). [Disney, Pixar]",8.8,Lee Unkrich,1 h 43 m,"['Animation', 'Adventure', 'Comedy', 'Family', 'Fantasy']"
The Souvenir,https://www.metacritic.com/a/img/resize/e1e1f6919c1c362862c2b156bbcef9fc3634b3c1/catalog/provider/2/2/2-5ebfbb09b982ce505438932893f70f60.jpg?auto=webp&fit=cover&height=132&width=88,2019,R,92.0,"A shy but ambitious film student (Honor Swinton Byrne) begins to find her voice as an artist while navigating a turbulent courtship with a charismatic but untrustworthy man (Tom Burke). She defies her protective mother (Tilda Swinton) and concerned friends as she slips deeper and deeper into an intense, emotionally fraught relationship that comes dangerously close to destroying her dreams. [A24]",6.2,Joanna Hogg,2 h,"['Drama', 'Romance']"
This Is Spinal Tap,https://www.metacritic.com/a/img/resize/b2f3b97eb5d4457ef2fe974826deee437f812b5a/catalog/provider/2/2/2-2fd0038d6f1fa05b6bdd2694465acfe2.jpg?auto=webp&fit=cover&height=132&width=88,1984,R,92.0,"Spinal Tap, one of England's loudest bands, is chronicled by film director Marty DiBergi on what proves to be a fateful tour.",8.0,Rob Reiner,1 h 22 m,"['Comedy', 'Music']"
Goodfellas,https://www.metacritic.com/a/img/resize/b2c4f14344308d6f88947f266f41cb33edd4700f/catalog/provider/5/2/5-tt7160372.jpg?auto=webp&fit=cover&height=132&width=88,1990,R,92.0,"Based on the bestselling book ""Wiseguy"" by Nicholas Pileggi, Scorsese's film profiles nearly 30 years of mob life in New York City.",8.7,Martin Scorsese,2 h 25 m,"['Biography', 'Crime', 'Drama']"
The Zone of Interest,https://www.metacritic.com/a/img/resize/67cb09fd157ae62e8912c3c66bfeda4b9f9502f9/catalog/provider/5/2/5-tt0058898.jpg?auto=webp&fit=cover&height=132&width=88,2023,PG-13,92.0,"The commandant of Auschwitz, Rudolf Höss, and his wife Hedwig, strive to build a dream life for their family in a house and garden next to the camp.",7.2,Jonathan Glazer,1 h 45 m,"['Drama', 'History', 'War']"
Alphaville,https://www.metacritic.com/a/img/resize/3308ba5f681a756dce221ecb579291ef405e4eff/catalog/provider/2/2/2-593bf9be386313fae75ec9373a967662.jpg?auto=webp&fit=cover&height=132&width=88,1965,Rated,92.0,A U.S. secret agent is sent to the distant space city of Alphaville where he must find a missing person and free the city from its tyrannical ruler.,0,Jean-Luc Godard,1 h 39 m,"['Drama', 'Mystery', 'Sci-Fi', 'Thriller']"
The Look of Silence,https://www.metacritic.com/a/img/resize/d37c089c273ff7b71627d7bf3627d20547999064/catalog/provider/2/2/2-813e562a7fc170e73dafa67bd85524e5.jpg?auto=webp&fit=cover&height=132&width=88,2015,PG-13,92.0,"The Look of Silence is Joshua Oppenheimer's powerful companion piece to the Oscar®-nominated The Act of Killing. Through Oppenheimer's footage of perpetrators of the 1965 Indonesian genocide, a family of survivors discovers how their son was murdered, as well as the identities of the killers. The documentary focuses on the youngest son, an optometrist named Adi, who decides to break the suffocating spell of submission and terror by doing something unimaginable in a society where the murderers remain in power: he confronts the men who killed his brother and, while testing their eyesight, asks them to accept responsibility for their actions.",8.2,Joshua Oppenheimer,1 h 43 m,"['Documentary', 'Biography', 'History']"
Tower,https://www.metacritic.com/a/img/resize/0ee1892d90dfcb5e953db6caf937a90e0083da9d/catalog/provider/5/2/5-tt7282468.jpg?auto=webp&fit=cover&height=132&width=88,2016,TV-14,92.0,"August 1, 1966, was the day our innocence was shattered. A sniper rode the elevator to the top floor of the iconic University of Texas Tower and opened fire, holding the campus hostage for 96 minutes in what was a previously unimaginable event. TOWER combines archival footage with rotoscopic animation of the dramatic day, based entirely on first person testimonies from witnesses, heroes and survivors, in a seamless and suspenseful retelling of the unfolding tragedy. The film highlights the fear, confusion, and visceral realities that changed the lives of those present, and the rest of us, forever – a day when the worst in one man brought out the best in so many others.",7.9,Keith Maitland,1 h 22 m,"['Documentary', 'Animation', 'Crime']"
Burning,https://www.metacritic.com/a/img/resize/59f43941556ad32023edb660ad53351a3906577f/catalog/provider/2/2/2-e038bfdf7e303cb9c5c783a7c9aec53d.jpg?auto=webp&fit=cover&height=132&width=88,2018,Rated,91.0,"The difficult life of Jongsu (Ah-in Yoo), a frustrated introvert, is complicated by the appearance of two people into his orbit: first, Haemi (Jong-seo Jun), a spirited woman who offers romantic possibility, and then, Ben (Steven Yeun), a wealthy and sophisticated young man she returns with from a trip. When Jongsu learns of Ben’s mysterious hobby and Haemi suddenly disappears, his confusion and obsessions begin to mount, culminating in a stunning finale.",7.8,Lee Chang-dong,2 h 28 m,"['Drama', 'Mystery', 'Thriller']"
Drive My Car,https://www.metacritic.com/a/img/resize/91ebdaf8c79e5e9d492963752d60f0cd8b5a51bd/catalog/provider/2/2/2-d55088a14edd494c5db16b908d2edadf.jpg?auto=webp&fit=cover&height=132&width=88,2021,Unrated,91.0,"Two years after his wife’s unexpected death, Yusuke Kafuku (Hidetoshi Nishijima), a renowned stage actor and director, receives an offer to direct a production of Uncle Vanya at a theater festival in Hiroshima. There, he meets Misaki Watari (Toko Miura), a taciturn young woman assigned by the festival to chauffeur him in his beloved red Saab 900. As the production’s premiere approaches, tensions mount amongst the cast and crew, not least between Yusuke and Koji Takatsuki, a handsome TV star who shares an unwelcome connection to Yusuke’s late wife. Forced to confront painful truths raised from his past, Yusuke begins - with the help of his driver – to face the haunting mysteries his wife left behind.  Adapted from Haruki Murakami’s short story. [Janus Films]",7.4,Ryûsuke Hamaguchi,2 h 59 m,['Drama']
A Summer's Tale,https://www.metacritic.com/a/img/resize/e5e4f3a9afedc4ac34f4d90b1330431b026aea11/catalog/provider/2/2/2-8f65674275ca286b14edfa9c383b6dd0.jpg?auto=webp&fit=cover&height=132&width=88,2014,G,91.0,"Gaspard (Melvil Poupaud), a recent university graduate, arrives at the seaside in Bretagne for a three week vacation before starting a new job. He’s hoping his sort-of girlfriend, the fickle Léna (Aurélia Nolin), will join him there; but as the days pass, he welcomes the interest of Margot (Amanda Langlet), a student of ethnology working as a waitress for the summer. Things start to get complicated when the spoken-for Margot encourages Gaspard to have a summer romance with her friend, Solène (Gwenaëlle Simon), and he complies. When Léna turns up, and scheduling complications abound, Gaspard will have to make a choice. [Big World Pictures]",7.9,Éric Rohmer,1 h 53 m,"['Comedy', 'Drama', 'Romance']"
Saint Omer,https://www.metacritic.com/a/img/resize/746bca2a4eb2fcf2ce3815447ebda17b3cd72cc0/catalog/provider/2/2/2-9015c6c1be3a95dccaaf1cf5e4e7530a.jpg?auto=webp&fit=cover&height=132&width=88,2023,PG-13,91.0,"Saint Omer court of law. Young novelist Rama attends the trial of Laurence Coly, a young woman accused of killing her 15-month-old daughter by abandoning her to the rising tide on a beach in northern France. But as the trial continues, the words of the accused and witness testimonies will shake Rama’s convictions and call into question our own judgment.",4.9,Alice Diop,2 h 2 m,['Drama']
Atanarjuat: The Fast Runner,https://www.metacritic.com/a/img/resize/4051137bd62fb0e15b6c7be9570c97f92477e16f/catalog/provider/2/2/2-94be433e5667ca130425f074c6fb6dc9.jpg?auto=webp&fit=cover&height=132&width=88,2002,R,91.0,"Evil in the form of an unknown shaman divides a small community of nomadic Inuit, upsetting its balance and spirit.  Twenty years pass. Two brothers emerge to challenge the evil order: Amaqjuaq, the Strong One, and Atanarjuat, the Fast Runner. [Lot 47 Films]",8.2,Zacharias Kunuk,2 h 52 m,['Drama']
Time,https://www.metacritic.com/a/img/resize/fbb3d8f70b903e14cc4a78f6ad76a9d1cc2befa2/catalog/provider/2/2/2-93100da97eed856f458a6a3a4092ebac.jpg?auto=webp&fit=cover&height=132&width=88,2020,PG-13,91.0,"Fox Rich is a fighter. The entrepreneur, abolitionist and mother of six boys has spent the last two decades campaigning for the release of her husband, Rob G. Rich, who is serving a 60-year sentence for a robbery they both committed in the early 90s in a moment of desperation. Combining the video diaries Fox has recorded for Rob over the years with intimate glimpses of her present-day life, director Garrett Bradley paints a mesmerizing portrait of the resilience and radical love necessary to prevail over the endless separations of the country’s prison-industrial complex.",6.9,Kim Ki-duk,1 h 37 m,"['Drama', 'Mystery', 'Romance']"
Gavagai,https://www.metacritic.com/a/img/resize/84d5765349dd1d1e2f68725c73c532497be11327/catalog/provider/2/2/2-19d14bce33b8b2dc50f15841bc714313.jpg?auto=webp&fit=cover&height=132&width=88,2018,Unrated,91.0,"German businessman Carsten Neuer travels to Norway to finish the impossible translation of some Norwegian poems by Tarjei Vesaas into Chinese, a project of his late wife. He hires Niko, a down-on-his-luck tour guide, to drive him to the poet’s home and places of inspiration to stimulate his own translation. On the road, the ghost of Carsten’s wife appears to him, while Niko struggles with the sudden consequences of his girlfriend’s pregnancy. On this journey, two very different men come to realize the transforming power of love, the limits of language, and the human need for friendship.",6.6,Rob Tregenza,1 h 30 m,['Drama']
A Bread Factory Part Two: Walk With Me a While,https://www.metacritic.com/a/img/resize/1284bda0ce3792624947be2efeb2163aece0219b/catalog/provider/2/2/2-7817da38128d063b12c664b68f71c498.jpg?auto=webp&fit=cover&height=132&width=88,2018,Unrated,91.0,"At The Bread Factory, they rehearse the Greek play, Hecuba. But the real theatrics are outside the theater where the town has been invaded by bizarre tourists and mysterious tech start-up workers. There is a new normal in Checkford, if it is even really Checkford any longer.",0,Patrick Wang,1 h 55 m,"['Comedy', 'Drama']"
The Killing,https://www.metacritic.com/a/img/resize/5bcafb08ccec044c21a6c553ae787705875ab1c8/catalog/provider/2/2/2-1d500b97d620867affbbd44ef2c79ed0.jpg?auto=webp&fit=cover&height=132&width=88,1956,Approved,91.0,Crook Johnny Clay assembles a five man team to plan and execute a daring race-track robbery.,7.6,Stanley Kubrick,1 h 24 m,"['Crime', 'Drama', 'Film-Noir', 'Thriller']"
Swing Time,https://www.metacritic.com/a/img/resize/148080f2261839a0ece2f0067ce52632d44ab452/catalog/provider/2/2/2-d48633a1ba96ab030489ce644c45c504.jpg?auto=webp&fit=cover&height=132&width=88,1936,Approved,91.0,"A performer and gambler travels to New York City to raise the $25,000 he needs to marry his fiancée, only to become entangled with a beautiful aspiring dancer.",6.5,George Stevens,1 h 43 m,"['Comedy', 'Musical', 'Romance']"
Breaking Away,https://www.metacritic.com/a/img/resize/e6e0a875fad83a0547d71b5c6f15b82626de98f9/catalog/provider/2/2/2-5e9edeee5326be8361debf7879849ab8.jpg?auto=webp&fit=cover&height=132&width=88,1979,PG,91.0,A small-town boy obsessed with the Italian cycling team vies for the affections of a college girl.,8.0,Peter Yates,1 h 41 m,"['Comedy', 'Drama', 'Sport']"
Lost in Translation,https://www.metacritic.com/a/img/resize/6451649dadb1f7e567232dc4e791bda8f599df0c/catalog/provider/5/2/5-tt0335266.jpg?auto=webp&fit=cover&height=132&width=88,2003,R,91.0,"Unable to sleep, Bob (Bill Murray) and Charlotte (Scarlett Johansson), two Americans in Tokyo, cross paths one night in the luxury hotel bar. This chance meeting soon becomes a surprising friendship. Charlotte and Bob venture through Tokyo, having often hilarious encounters with its citizens, and ultimately discover a new belief in life's possibilities. [Focus Features]",8.0,Sofia Coppola,1 h 42 m,"['Comedy', 'Drama']"
After Life,https://www.metacritic.com/a/img/resize/c675ac35bcbc0b778d2be415415b8123447f5b8d/catalog/provider/2/2/2-b76764028c67e855c71088d7f5336842.jpg?auto=webp&fit=cover&height=132&width=88,1999,Rated,91.0,"After death, people have just one week to choose only a memory to keep for eternity.",6.7,Hirokazu Koreeda,1 h 59 m,"['Drama', 'Fantasy']"
Son of Saul,https://www.metacritic.com/a/img/resize/d9d1fecde0221a12e51a1411fb4674a6bc08e2b9/catalog/provider/2/2/2-183a271796b8b76982b89bb23729b828.jpg?auto=webp&fit=cover&height=132&width=88,2015,R,91.0,"October 1944, Auschwitz-Birkenau. Saul Ausländer is a Hungarian member of the Sonderkommando, the group of Jewish prisoners isolated from the camp and forced to assist the Nazis in the machinery of large-scale extermination. While working in one of the crematoriums, Saul discovers the corpse of a boy he takes for his son. As the Sonderkommando plans a rebellion, Saul decides to carry out an impossible task: save the child’s body from the flames, find a rabbi to recite the mourner’s Kaddish and offer the boy a proper burial.",7.3,László Nemes,1 h 47 m,"['Drama', 'War']"
Love Affair,https://www.metacritic.com/a/img/resize/65c7d71fe8acf3be8499e5803646d969702c076f/catalog/provider/2/2/2-5e441264c8dce7d1eed8c9d4c9818016.jpg?auto=webp&fit=cover&height=132&width=88,1939,TV-G,91.0,"A French playboy and an American former nightclub singer fall in love aboard a ship. They arrange to reunite six months later, after he has had a chance to earn a decent living.",0,Glenn Gordon Caron,1 h 48 m,"['Comedy', 'Drama', 'Romance']"
Frankenstein,https://www.metacritic.com/a/img/resize/722165e06bb6a901191b22a1d6aaf8d7b4298d47/catalog/provider/2/2/2-dde892fffdde5c04d58124eb213c6f2b.jpg?auto=webp&fit=cover&height=132&width=88,1931,Approved,91.0,An obsessed scientist assembles a living being from parts of exhumed corpses.,7.9,James Whale,1 h 10 m,"['Drama', 'Horror', 'Sci-Fi', 'Thriller']"
Little Women,https://www.metacritic.com/a/img/resize/fc2563c83a2ae59303236bc35d9e463f99cb7575/catalog/provider/2/2/2-f97417f151cb99737c75cc6dd992ee98.jpg?auto=webp&fit=cover&height=132&width=88,2019,PG,91.0,"Little Women draws on both the classic novel and the writings of Louisa May Alcott, and unfolds as the author’s alter ego, Jo March, reflects back and forth on her fictional life.  In writer-director Greta Gerwig’s take, the beloved story of the March sisters—four young women each determined to live life on her own terms—is both timeless and timely.",7.6,Gillian Armstrong,1 h 55 m,"['Drama', 'Family', 'Romance']"
The African Queen,https://www.metacritic.com/a/img/resize/120777e93757ff4dc1d171852e576ebc4909f62f/catalog/provider/2/2/2-b4827515d32f0401d5c15c3f0b482488.jpg?auto=webp&fit=cover&height=132&width=88,1952,Approved,91.0,"In Africa during World War I, a gin-swilling riverboat captain is persuaded by a strait-laced missionary to use his boat to attack an enemy warship.",7.3,John Huston,1 h 45 m,"['Adventure', 'Drama', 'Romance', 'War']"
