Title,Image Link,Release,Rating,Metacritic,Description,Audience,Directors,Runtime,Genres
Dekalog (1988),https://www.metacritic.com/a/img/resize/2162216e0eddb77ee2faa85f1cd7c7ca5a0026b9/catalog/provider/2/2/2-33ff5c9171bee2da94bcbe5abcae60fd.jpg?auto=webp&fit=cover&height=132&width=88,1996,TV-MA,100.0,"This masterwork by Krzysztof Kieślowski is one of the twentieth century’s greatest achievements in visual storytelling. Originally made for Polish television, Dekalog focuses on the residents of a housing complex in late-Communist Poland, whose lives become subtly intertwined as they face emotional dilemmas that are at once deeply personal and universally human. Its ten hour-long films, drawing from the Ten Commandments for thematic inspiration and an overarching structure, grapple deftly with complex moral and existential questions concerning life, death, love, hate, truth, and the passage of time. Shot by nine different cinematographers, with stirring music by Zbigniew Preisner and compelling performances from established and unknown actors alike, Dekalog arrestingly explores the unknowable forces that shape our lives. Also available are the longer theatrical versions of the series’ fifth and sixth films: A Short Film About Killing and A Short Film About Love. [Janus Films]",7.4,Krzysztof Kieslowski,9 h 32 m,['Drama']
Casablanca,https://www.metacritic.com/a/img/resize/78c048faee35bacbfc0cb239831a7c7e50fcab7a/catalog/provider/2/2/2-d377eed3f868f2f56e42767822188b73.jpg?auto=webp&fit=cover&height=132&width=88,1943,PG,100.0,"A Casablanca, Morocco casino owner in 1941 shelters his former lover and her husband, a Czechoslovakian freedom fighter, from the Nazis.",8.8,Michael Curtiz,1 h 42 m,"['Drama', 'Romance', 'War']"
The Conformist,https://www.metacritic.com/a/img/resize/1fd4889917b24ad7003586ee84ed5f7a151199fb/catalog/provider/2/2/2-dd018c5d82b77507bdac403f5f7c217b.jpg?auto=webp&fit=cover&height=132&width=88,1970,R,100.0,"Set in Rome in the 1930s, this re-release of Bernardo Bertolucci's 1970 breakthrough feature stars Jean-Louis Trintignant as a Mussolini operative sent to Paris to locate and eliminate an old professor who fled Italy when the fascists came to power.",7.3,Bernardo Bertolucci,1 h 53 m,['Drama']
Lawrence of Arabia (re-release),https://www.metacritic.com/a/img/resize/ec76d64ca9f1f4d310412559f1a0c608d5970e95/catalog/provider/2/2/2-0d39c766b1fa2252bd609e914d0647af.jpg?auto=webp&fit=cover&height=132&width=88,2002,PG,100.0,"The 40th anniversary re-release of David Lean's 1962 masterpiece, starring Peter O'Toole in one of the most electrifying debuts in film history.",8.6,David Lean,3 h 38 m,"['Adventure', 'Biography', 'Drama', 'War']"
The Leopard (re-release),https://www.metacritic.com/a/img/resize/4236100026e3852c27d0402f3e15faf84c9277d3/catalog/provider/2/2/2-3ca5c775436114bc6d99f12ae3dace0a.jpg?auto=webp&fit=cover&height=132&width=88,2004,Approved,100.0,"Set in Sicily in 1860, Luchino Visconti's spectacular 1963 adaptation of Giuseppe di Lampedusa's international bestseller is one of the cinema's greatest evocations of the past, achingly depicting the passing of an ancient order. (Film Forum)",7.8,Luchino Visconti,3 h 6 m,"['Drama', 'History']"
Three Colors: Red,https://www.metacritic.com/a/img/resize/9181df467182536fd5b68b064217a16a8720a97e/catalog/provider/2/2/2-bee46070b1964833c696e09ad13f72fe.jpg?auto=webp&fit=cover&height=132&width=88,1994,R,100.0,"Krzysztof Kieslowski closes his Three Colors trilogy in grand fashion, with an incandescent meditation on fate and chance, starring Irène Jacob as a sweet-souled yet somber runway model in Geneva whose life dramatically intersects with that of a bitter retired judge, played by Jean-Louis Trintignant. Meanwhile, just down the street, a seemingly unrelated story of jealousy and betrayal unfolds. Red is an intimate look at forged connections and a splendid final statement from a remarkable filmmaker at the height of his powers. [Criterion]",8.3,Krzysztof Kieslowski,1 h 39 m,"['Drama', 'Mystery', 'Romance']"
Tokyo Story,https://www.metacritic.com/a/img/resize/6f8e7996250da0e01df62c2b01a1c01ff9466b72/catalog/provider/2/2/2-7588bc24cecfa69cdf24798d48b0491c.jpg?auto=webp&fit=cover&height=132&width=88,1972,Rated,100.0,"Yasujiro Ozu’s Tokyo Story follows an aging couple, Tomi and Sukichi, on their journey from their rural village to visit their two married children in bustling, postwar Tokyo. Their reception is disappointing: too busy to entertain them, their children send them off to a health spa. After Tomi falls ill she and Sukichi return home, while the children, grief-stricken, hasten to be with her. From a simple tale unfolds one of the greatest of all Japanese films. Starring Ozu regulars Chishu Ryu and Setsuko Hara, the film reprises one of the director’s favorite themes—that of generational conflict—in a way that is quintessentially Japanese and yet so universal in its appeal that it continues to resonate as one of cinema’s greatest masterpieces. [Janus Films]",8.2,Yasujirô Ozu,2 h 16 m,['Drama']
Boyhood,https://www.metacritic.com/a/img/resize/5e2347af172196e6c7076494b7e8ce26fd832f72/catalog/provider/2/2/2-e25db87c9adea62102834d1cc06d3705.jpg?auto=webp&fit=cover&height=132&width=88,2014,R,100.0,"Filmed over 12 years with the same cast, Richard Linklater's Boyhood is a groundbreaking story of growing up as seen through the eyes of a child named Mason (Ellar Coltrane), who literally grows up on screen before our eyes. Starring Ethan Hawke and Patricia Arquette as Mason's parents and newcomer Lorelei Linklater as his sister Samantha, Boyhood charts the rocky terrain of childhood like no other film has before and is both a nostalgic time capsule of the recent past and an ode to growing up and parenting. [IFC Films]",7.5,Richard Linklater,2 h 45 m,['Drama']
Citizen Kane,https://www.metacritic.com/a/img/resize/b6f5368a0598a7692eb50d6ca219d64a49a46ee1/catalog/provider/2/2/2-16b148bab11c417f2b2ca06404a8c514.jpg?auto=webp&fit=cover&height=132&width=88,1941,Approved,100.0,"Following the death of a publishing tycoon, news reporters scramble to discover the meaning of his final utterance.",8.4,Orson Welles,1 h 59 m,"['Drama', 'Mystery']"
The Godfather,https://www.metacritic.com/a/img/resize/77d5d0bdf680af8d397d7c648d3675323e0e1c06/catalog/provider/2/2/2-40b421c7cfe1b3059d5e50d79e968270.jpg?auto=webp&fit=cover&height=132&width=88,1972,R,100.0,"Francis Ford Coppola's epic features Marlon Brando in his Oscar-winning role as the patriarch of the Corleone family. Director Coppola paints a chilling portrait of the Sicilian clan's rise and near fall from power in America, masterfully balancing the story between the Corleone's family life and the ugly crime business in which they are engaged. Based on Mario Puzo's best-selling novel and featuring career-making performances by Al Pacino, James Caan and Robert Duvall, this searing and brilliant film garnered ten Academy Award nominations, and won three including Best Picture of 1972. [Paramount Pictures]",9.3,Francis Ford Coppola,2 h 55 m,"['Crime', 'Drama']"
Rear Window,https://www.metacritic.com/a/img/resize/d684a092f00c5b2a0cbb30f45bbb4455c29c6165/catalog/provider/2/2/2-5e97d33d56f0568dd7ef759bcf9cf360.jpg?auto=webp&fit=cover&height=132&width=88,1954,Approved,100.0,A wheelchair-bound photographer spies on his neighbours from his apartment window and becomes convinced one of them has committed murder.,8.7,Alfred Hitchcock,1 h 52 m,"['Mystery', 'Thriller']"
Vertigo,https://www.metacritic.com/a/img/resize/6aaa27f6c00b2e1e4a8e3ef87000e41fafeff14b/catalog/provider/2/2/2-e384f9f78bf9fad12ab0c8a9955200b9.jpg?auto=webp&fit=cover&height=132&width=88,1958,Approved,100.0,"Vertigo creates a dizzying web of mistaken identity, passion and murder after an acrophobic detective rescues a mysterious blonde from the bay. [Universal Pictures]",8.6,Alfred Hitchcock,2 h 8 m,"['Mystery', 'Romance', 'Thriller']"
Notorious,https://www.metacritic.com/a/img/resize/bb5b4c782971c01347385c1305417103c7d4f0ef/catalog/provider/2/2/2-0488aa04afd924c82eaa2b421b54a8e3.jpg?auto=webp&fit=cover&height=132&width=88,1946,Approved,100.0,A woman is asked to spy on a group of Nazi friends in South America. How far will she have to go to ingratiate herself with them?,6.2,George Tillman Jr.,2 h 2 m,"['Biography', 'Crime', 'Drama', 'Music']"
Fanny and Alexander (re-release),https://www.metacritic.com/a/img/resize/7a92f52a0d894596594d0d71b85c3e779d8f9a68/catalog/provider/2/2/2-10f706cfc36609b1d0f0bbf120c90028.jpg?auto=webp&fit=cover&height=132&width=88,2004,R,100.0,"Set in Sweden in the early 20th century, this film focuses on the young children of a wealthy, theatrical family.",8.4,Ingmar Bergman,3 h 8 m,['Drama']
Singin' in the Rain,https://www.metacritic.com/a/img/resize/d65d2d66c73304c93a2f43f1eb89dea63da7aa71/catalog/provider/2/2/2-fec6270799b9fadd4196b2d483682df8.jpg?auto=webp&fit=cover&height=132&width=88,1952,Approved,99.0,A silent film production company and cast make a difficult transition to sound.,8.7,"Stanley Donen,

      Gene Kelly",1 h 43 m,"['Comedy', 'Musical', 'Romance']"
Playtime,https://www.metacritic.com/a/img/resize/1a68f9bb72512d9c807db7178bc92ea3622b6847/catalog/provider/2/2/2-55f1363b1592333712f7f73dfed76395.jpg?auto=webp&fit=cover&height=132&width=88,1973,Rated,99.0,"Monsieur Hulot curiously wanders around a high-tech Paris, paralleling a trip with a group of American tourists. Meanwhile, a nightclub/restaurant prepares its opening night, but it's still under construction.",7.8,Jacques Tati,2 h 35 m,['Comedy']
Touch of Evil,https://www.metacritic.com/a/img/resize/985418950c4aac1ca44bb4a143a9641e6b1cbc75/catalog/provider/5/2/5-tt0052311.jpg?auto=webp&fit=cover&height=132&width=88,1958,Approved,99.0,"This film noir portrait of corruption and morally-compromised obsessions stars Welles as Hank Quinlan, a crooked police chief who frames a Mexican youth as part of an intricate criminal plot. Charlton Heston plays an honorable Mexican narcotics investigator who clashes with the bigoted Quinlan after probing into his dark past. A memorable supporting cast including Janet Leigh as Heston's inquisitive wife, Akim Tamiroff as a seedy underworld leader, Zsa Zsa Gabor and Marlene Dietrich as an enigmatic gypsy complete this fascinating drama engulfed in haunting cinematography and a magnificently eerie score by Henry Mancini.",8.2,Orson Welles,1 h 35 m,"['Crime', 'Drama', 'Film-Noir', 'Thriller']"
Army of Shadows,https://www.metacritic.com/a/img/resize/2c2f56733e2058d378123a19a23ce484b3dda395/catalog/provider/2/2/2-63a7af0544d5c063733dd31147b32fe2.jpg?auto=webp&fit=cover&height=132&width=88,2006,Rated,99.0,"Making its U.S. debut, Jean-Pierre Melville's 1969 Army of Shadows is an intimate epic of the French Resistance in WWII.",7.8,Jean-Pierre Melville,2 h 25 m,"['Drama', 'War']"
City Lights,https://www.metacritic.com/a/img/resize/d29c0efb845c7c98716acdfc8cd4a3959bf26ff9/catalog/provider/2/2/2-5dbe8bb254d5e8fd18533c123c556ed3.jpg?auto=webp&fit=cover&height=132&width=88,1931,G,99.0,The Tramp (Charlie Chaplin) struggles to help a blind flower girl he has fallen in love with.,8.6,Charles Chaplin,1 h 27 m,"['Comedy', 'Drama', 'Romance']"
Moonlight,https://www.metacritic.com/a/img/resize/e6e39a40db538d5f0100e1d09d4c4a0723839d6c/catalog/provider/2/2/2-d8c1e3566ba713bc1a11d8bb54378aa3.jpg?auto=webp&fit=cover&height=132&width=88,2016,R,99.0,"Moonlight is the tender, heartbreaking story of a young man’s struggle to find himself, told across three defining chapters in his life as he experiences the ecstasy, pain, and beauty of falling in love, while grappling with his own sexuality.",0,Paula van der Oest,1 h 30 m,['Thriller']
Intolerance,https://www.metacritic.com/a/img/resize/2d8463364a443f15a6c3176b6a76b238c112c428/catalog/provider/5/2/5-tt0006864.jpg?auto=webp&fit=cover&height=132&width=88,1916,Passed,99.0,"The story of a poor young woman, separated by prejudice from her husband and baby, is interwoven with tales of intolerance from throughout history.",6.8,D.W. Griffith,2 h 43 m,"['Drama', 'History']"
The Rules of the Game,https://www.metacritic.com/a/img/resize/23bda157dad3312cb54dd83e344e4558024cc694/catalog/provider/2/2/2-21ec091d78c78cd5e2224153d7c620d0.jpg?auto=webp&fit=cover&height=132&width=88,1950,Rated,99.0,"A bourgeois life in France at the onset of World War II, as the rich and their poor servants meet up at a French chateau.",7.7,Jean Renoir,1 h 50 m,"['Comedy', 'Drama']"
Pinocchio,https://www.metacritic.com/a/img/resize/938499ce4ef2673e76de661e242cc163465cb7fa/catalog/provider/2/2/2-293ce5f1132b6801354519e880290d98.jpg?auto=webp&fit=cover&height=132&width=88,1940,G,99.0,"A living puppet, with the help of a cricket as his conscience, must prove himself worthy to become a real boy.",4.5,Roberto Benigni,1 h 48 m,"['Comedy', 'Family', 'Fantasy']"
Seven Samurai,https://www.metacritic.com/a/img/resize/b5ef93b65073c5786417b3b88d243e5ebeb3cbaa/catalog/provider/2/2/2-4b4ccbca6c3d3dbb6ff2f1a6c6cf703b.jpg?auto=webp&fit=cover&height=132&width=88,1956,Rated,98.0,Seven Samurai (Shichinin no samurai) tells the story of a sixteenth-century village whose desperate inhabitants hire the eponymous warriors to protect them from invading bandits.,8.8,Akira Kurosawa,3 h 27 m,"['Action', 'Drama']"
The Wild Bunch,https://www.metacritic.com/a/img/resize/a2952503e9ccd648e782e9f39885575ba5e478f5/catalog/provider/2/2/2-d4ea24b1892db81fa2229630260b5670.jpg?auto=webp&fit=cover&height=132&width=88,1969,R,98.0,"An aging group of outlaws look for one last big score as the ""traditional"" American West is disappearing around them.",7.7,Sam Peckinpah,2 h 25 m,"['Action', 'Adventure', 'Drama', 'Western']"
Au hasard Balthazar,https://www.metacritic.com/a/img/resize/5adaf397673ac636778a78a4dae2f73ef15a7522/catalog/provider/2/2/2-b063d321df280c23b2973f7ee22b2752.jpg?auto=webp&fit=cover&height=132&width=88,1966,Rated,98.0,Robert Bresson's 1966 film focuses on the story of the donkey Balthazar and the people around him.,7.1,Robert Bresson,1 h 35 m,['Drama']
The Lady Vanishes,https://www.metacritic.com/a/img/resize/3edf6d94a3c6941ff2b4d4ed63823992024cf77d/catalog/provider/2/2/2-a3a2f081a57ea157ad8c5ca89fa218b8.jpg?auto=webp&fit=cover&height=132&width=88,1938,Rated,98.0,"While travelling in continental Europe, a rich young playgirl realizes that an elderly lady seems to have disappeared from the train.",0,Anthony Page,1 h 37 m,"['Action', 'Comedy', 'Mystery', 'Romance', 'Thriller']"
The Treasure of the Sierra Madre,https://www.metacritic.com/a/img/resize/e88529e70dfbbf32f31f7125d124d0099b095210/catalog/provider/2/2/2-59e6338377d302846990e1dbb8c1cbd8.jpg?auto=webp&fit=cover&height=132&width=88,1948,Approved,98.0,"Fred Dobbs and Bob Curtin, two Americans searching for work in Mexico, convince an old prospector to help them mine for gold in the Sierra Madre Mountains.",8.1,John Huston,2 h 6 m,"['Adventure', 'Drama', 'Western']"
Pan's Labyrinth,https://www.metacritic.com/a/img/resize/e0adc846acb3641107425322bfab96d0b76dc1d6/catalog/provider/2/2/2-89a55c670dbb2e65c56e0fa0675abf0e.jpg?auto=webp&fit=cover&height=132&width=88,2006,R,98.0,"Following a bloody civil war, young Ofelia enters a world of unimaginable cruelty when she moves in with her new stepfather, a tyrannical military officer. Armed with only her imagination, Ofelia discovers a mysterious labyrinth and meets a faun who sets her on a path to saving herself and her ailing mother. But soon, the lines between fantasy and reality begin to blur, and before Ofelia can turn back, she finds herself at the center of a ferocious battle between good and evil. [Warner Bros.]",8.8,Guillermo del Toro,1 h 58 m,"['Drama', 'Fantasy', 'War']"
Some Like It Hot,https://www.metacritic.com/a/img/resize/0648cea56238ee0689fa00eefae59d5264a1a824/catalog/provider/2/2/2-35e374e77942f4f468ea377e16cf0113.jpg?auto=webp&fit=cover&height=132&width=88,1959,Approved,98.0,"When two male musicians witness a mob hit, they flee the state in an all-female band disguised as women, but further complications set in.",8.3,Billy Wilder,2 h 1 m,"['Comedy', 'Music', 'Romance']"
North by Northwest,https://www.metacritic.com/a/img/resize/8107f30b14737f17289acb1180f7cc66ae1cdf18/catalog/provider/2/2/2-7c20dd64dd41531cb811890ad4806d3c.jpg?auto=webp&fit=cover&height=132&width=88,1959,Approved,98.0,"A hapless New York advertising executive is mistaken for a government agent by a group of foreign spies, and is pursued across the country while he looks for a way to survive.",8.1,Alfred Hitchcock,2 h 16 m,"['Action', 'Adventure', 'Mystery', 'Thriller']"
Hoop Dreams,https://www.metacritic.com/a/img/resize/e70b9abe477dc8b5531c23366646c1fc90a8d0a7/catalog/provider/2/2/2-4877adb1544395b95ac11227b5be6116.jpg?auto=webp&fit=cover&height=132&width=88,1994,PG-13,98.0,Two inner-city Chicago boys with hopes of becoming professional basketball players struggle to become college players.,7.9,Steve James,2 h 50 m,"['Documentary', 'Drama', 'Sport']"
Rashomon,https://www.metacritic.com/a/img/resize/227ec0272302deb62cd5486d16ee9ec500a9bdaf/catalog/provider/2/2/2-953f9531a146f6b7373cc10db6bc7c13.jpg?auto=webp&fit=cover&height=132&width=88,1951,Rated,98.0,"The rape of a bride and the murder of her samurai husband are recalled from the perspectives of a bandit, the bride, the samurai's ghost and a woodcutter.",8.4,Akira Kurosawa,1 h 28 m,"['Crime', 'Drama', 'Mystery']"
The Passion of Joan of Arc,https://www.metacritic.com/a/img/resize/b71c497fe54386bf0d91860c8d2d08697ca0d758/catalog/provider/2/2/2-34751db0949b9c0354937264d78da868.jpg?auto=webp&fit=cover&height=132&width=88,1929,Passed,98.0,"In 1431, Jeanne d'Arc is placed on trial on charges of heresy. The ecclesiastical jurists attempt to force Jeanne to recant her claims of holy visions.",8.1,Carl Theodor Dreyer,1 h 50 m,"['Biography', 'Drama', 'History']"
All About Eve,https://www.metacritic.com/a/img/resize/0609dd34e6ab844f1952a14c0848f284e695345a/catalog/provider/2/2/2-fec55955def683ee28baaead94a2855a.jpg?auto=webp&fit=cover&height=132&width=88,1950,Approved,98.0,An ingenue insinuates herself into the company of an established but aging stage actress and her circle of theater friends.,8.7,Joseph L. Mankiewicz,2 h 18 m,['Drama']
Metropolis (re-release),https://www.metacritic.com/a/img/resize/0ebdcf3e08281a3eba7fc25faca50e8fc0e363d4/catalog/provider/2/2/2-f67efa682397ab2c1f442078a5c383ff.jpg?auto=webp&fit=cover&height=132&width=88,2002,Rated,98.0,"Possibly the crowning achievement of silent cinema, Fritz Lang's 1927 blockbuster fuses the frenetic storytelling of twenties pulp fiction with Lang's personal fascination with the darker side of human nature.  (Kino International)",8.5,Fritz Lang,2 h 33 m,"['Drama', 'Sci-Fi']"
Jules and Jim,https://www.metacritic.com/a/img/resize/3828cb5e25ba694a10c2da84ed4973c73315fcf5/catalog/provider/2/2/2-b7860970c1a8f6a40597038a55208284.jpg?auto=webp&fit=cover&height=132&width=88,1962,Rated,97.0,Decades of a love triangle concerning two friends and an impulsive woman.,6.9,François Truffaut,1 h 45 m,"['Drama', 'Romance']"
My Left Foot,https://www.metacritic.com/a/img/resize/a10600bcd8f7295d0540776e7bbacf4832cc50e0/catalog/provider/2/2/2-87bb28b6ca28c59e24e48412e722a2b0.jpg?auto=webp&fit=cover&height=132&width=88,1989,R,97.0,"True story of cerebral palsied Christy Brown, who overcame his illness and poverty to become an accomplished artist, poet and writer.",8.3,Jim Sheridan,1 h 43 m,"['Biography', 'Drama']"
The Night of the Hunter,https://www.metacritic.com/a/img/resize/ecc8a630ad2a97639f8780ebc67b0a5e9e032166/catalog/provider/2/2/2-e7b9814bace1b20265067790bc47ef7c.jpg?auto=webp&fit=cover&height=132&width=88,1955,Approved,97.0,A traveling preacher's (Robert Mitchum) nefarious motives for marrying a fragile widow (Shelley Winters) are uncovered by her terrified young children.,8.2,Charles Laughton,1 h 32 m,"['Crime', 'Drama', 'Film-Noir', 'Thriller']"
Ran,https://www.metacritic.com/a/img/resize/7f40b1e3bcd45cfef97dde77ff39f4e3d27a2c6b/catalog/provider/2/2/2-3ba10e160130145833d6bfc2637b218c.jpg?auto=webp&fit=cover&height=132&width=88,1985,R,97.0,"An adaptation of William Shakespeare’s King Lear, Ran considers the disastrous consequences of Lord Hidetora Ichimonji’s (Tatsuya Nakadai) decision to split his kingdom among his three sons.",8.4,Akira Kurosawa,2 h 40 m,"['Action', 'Drama', 'War']"
Gone with the Wind,https://www.metacritic.com/a/img/resize/8054e70e810ce503cca4426ddba4bf29b410bc85/catalog/provider/2/2/2-bd76e04c5a52abbbc01c2eec0c5d1445.jpg?auto=webp&fit=cover&height=132&width=88,1940,Approved,97.0,"A Southern belle struggles with the devastation of the Civil War and Reconstruction. This classic won 8 Academy Awards, including Best Picture.",8.2,"Victor Fleming,

      George Cukor,

      Sam Wood",3 h 58 m,"['Drama', 'Romance', 'War']"
The Third Man,https://www.metacritic.com/a/img/resize/8fe6ac3a2d7e652dfbe49140e389422189055a08/catalog/provider/2/2/2-4cabb3a923ea32388056693093bed1c0.jpg?auto=webp&fit=cover&height=132&width=88,1949,TV-PG,97.0,"Pulp novelist Holly Martins travels to shadowy, postwar Vienna, only to find himself investigating the mysterious death of an old friend, Harry Lime.",8.4,Carol Reed,1 h 44 m,"['Film-Noir', 'Mystery', 'Thriller']"
"Quo Vadis, Aida?",https://www.metacritic.com/a/img/resize/67f596420e44e7f6abe1ca872155f7c52c905fcb/catalog/provider/2/2/2-ce052d31ece8e28d24d4d09e62745b2a.jpg?auto=webp&fit=cover&height=132&width=88,2021,Approved,97.0,"Bosnia, July 11th 1995.  Aida is a translator for the United Nations in the small town of Srebrenica. When the Serbian army takes over the town, her family is among the thousands of citizens looking for shelter in the UN camp. As an insider to the negotiations Aida has access to crucial information that she needs to interpret. What is at the horizon for her family and people - rescue or death? Which move should she take? [Super LTD]",8.1,Jasmila Zbanic,1 h 41 m,"['Drama', 'History', 'War']"
Psycho,https://www.metacritic.com/a/img/resize/55db70482df04f4689970442796fcc78d0cac55b/catalog/provider/2/2/2-0a64812fb15c85c9e7d9ab09f04238cb.jpg?auto=webp&fit=cover&height=132&width=88,1960,Approved,97.0,"A Phoenix secretary embezzles $40,000 from her employer's client, goes on the run, and checks into a remote motel run by a young man, Norman Bates (Anthony Perkins) under the domination of his mother.",7.6,Gus Van Sant,1 h 45 m,"['Horror', 'Mystery', 'Thriller']"
Rififi (re-release),https://www.metacritic.com/a/img/resize/052e9eb876c8c6e9ee6b256a448a54c0e69fc87d/catalog/provider/2/2/2-1cd98bbe0c5d28b7b8b502176df7e3da.jpg?auto=webp&fit=cover&height=132&width=88,2000,Rated,97.0,"A reissue of a classic French caper thriller in which Tony, fresh out of prison, teams with three cohorts to pull off a major jewel heist which goes awry.  The film's title is slang for ""rough stuff,"" and it's robbery sequence is famous for its exciting, completely silent robbery scene.",8.1,Jules Dassin,1 h 58 m,"['Crime', 'Drama', 'Thriller']"
"4 Months, 3 Weeks and 2 Days",https://www.metacritic.com/a/img/resize/3884dc40fc69a72e0f15b2308fa3446966c3978a/catalog/provider/2/2/2-808bb3acc87fc9a62e456c127fc1b970.jpg?auto=webp&fit=cover&height=132&width=88,2008,Rated,97.0,"During the final days of communism in Romania, two college roommates Otilia and Gabita are busy preparing for a night away. But rather than planning for a holiday, they are making arrangements for Gabita's illegal abortion and unwittingly, both find themselves burrowing deep down a rabbit hole of unexpected revelations. [IFC Films]",8.0,Cristian Mungiu,1 h 53 m,['Drama']
Parasite,https://www.metacritic.com/a/img/resize/7862e358c60d7e99e4ba408cbd21714f54ec933a/catalog/provider/2/2/2-8a8e64076621c48ff9f12f5bf72085e1.jpg?auto=webp&fit=cover&height=132&width=88,2019,R,97.0,"Meet the Park Family: the picture of aspirational wealth. And the Kim Family, rich in street smarts but not much else. Be it chance or fate, these two houses are brought together and the Kims sense a golden opportunity. Masterminded by college-aged Ki-woo, the Kim children expediently install themselves as tutor and art therapist, to the Parks. Soon, a symbiotic relationship forms between the two families. The Kims provide “indispensable” luxury services while the Parks obliviously bankroll their entire household. When a parasitic interloper threatens the Kims’ newfound comfort, a savage, underhanded battle for dominance breaks out, threatening to destroy the fragile ecosystem between the Kims and the Parks. [Neon]",8.7,Bong Joon Ho,2 h 12 m,"['Drama', 'Thriller']"
Battleship Potemkin,https://www.metacritic.com/a/img/resize/5a3790ad5a5c4051de310b672e79d92af53ff37d/catalog/provider/2/2/2-c1d187a23ece23b2621bb66c0ec2c0ec.jpg?auto=webp&fit=cover&height=132&width=88,1926,TV-14,97.0,"In the midst of the Russian Revolution of 1905, the crew of the battleship Potemkin mutiny against the brutal, tyrannical regime of the vessel's officers. The resulting street demonstration in Odessa brings on a police massacre.",8.6,Sergei Eisenstein,1 h 15 m,"['Drama', 'History', 'Thriller', 'War']"
A Streetcar Named Desire,https://www.metacritic.com/a/img/resize/86da70fc0e428a1dce3dcfc388eece1957ba55e5/catalog/provider/2/2/2-3476fff1b9fc43b6cec744b6c86cbfcf.jpg?auto=webp&fit=cover&height=132&width=88,1951,Approved,97.0,Disturbed Blanche DuBois (Vivien Leigh) moves in with her sister in New Orleans and is tormented by her brutish brother-in-law (Marlon Brando) while her reality crumbles around her.,8.3,Elia Kazan,2 h 2 m,['Drama']
